Name,Description,"Software URL",Docs,License,Topic,Tags
RELION,"RELION (for REgularised LIkelihood OptimisatioN) is a stand-alone computer program for Maximum A Posteriori refinement of (multiple) 3D reconstructions or 2D class averages in cryo-electron microscopy. It is developed in the research group of Sjors Scheres at the MRC Laboratory of Molecular Biology. Description Source: https://​github.​com/​3dem/​relion&nbsp;",https://relion.readthedocs.io/en/,,"Open-Source License","structural biology, biophysics","structural-biology, image-processing, gpu"
RStudio,"RStudio is an integrated development environment (IDE) for the R and Python. It includes a console, syntax-highlighting editor that supports direct code execution, and tools for plotting, history, debugging and workspace management. Description Source: https://​posit.​co/​products/​open-source/​rstudio/​",https://posit.co/products/open-source/rstudio/,,"Open-Source License","statistics and probability, data science, social sciences","r, statistics, data-analysis"
SageMath,"SageMath is a free open-source mathematics software system licensed under the GPL. It builds on top of many existing open-source packages: NumPy, SciPy, matplotlib, Sympy,Maxima, GAP, FLINT, R and many more. Access their combined power through a common, Python-based language or directly via interfaces or wrappers.",https://www.sagemath.org/,,"Open-Source License","mathematics, applied mathematics","mathematics, data-analysis, programming"
SAS,"SAS Viya is a cloud-native software platform for data management, analytics, and AI. It provides tools for connecting, preparing, and governing data across different systems and formats, and includes features for building and running advanced analytics and machine learning models.",https://www.sas.com/en_us/home.html,,"Commercial License","statistics and probability, social sciences, economics and business","sas, statistics, data-analysis"
Schrodinger,"Schrödinger's software is used by pharmaceutical companies, biotech firms, and academic researchers to simulate and model the behavior of molecules at the atomic level. This accelerates the design and develops new drugs and materials more efficiently, reducing the time and cost of bringing them to market.",https://www.schrodinger.com/,,"Commercial License","chemistry, computational chemistry, drug discovery","computational-chemistry, chemistry, simulation"
Shiny,"R Shiny is a web application framework for R that allows users to create interactive web applications directly from R. It enables data scientists to develop interactive, web-based dashboards, visualizations, and applications without needing to know HTML, CSS, or JavaScript.",https://shiny.posit.co,,"Open-Source License","statistics and probability, data visualization, data science","visualization, data-analysis, gui"
Siril,"Siril is a software application for astrophotography, which allows pre-processing and processing of images from any type of camera (CCD, planetary camera, webcam etc.). The images must be converted to 32-bit FITS format which is the format used natively by Siril.",https://siril.org/,,"Open-Source License","astronomy and planetary sciences","astronomy, image-processing, visualization"
Spyder,"Spyder is an open source, community-developed scientific environment and IDE written in Python, for Python. As scientists, engineers and analysts just like you, we built it to combine the power of a comprehensive development tool with the speed of an interactive data exploration package, all in one easy-to-use interface.&nbsp;",https://www.spyder-ide.org/,,"Open-Source License","computer science, data science","python, data-analysis, programming"
STAR-CCM+,"Simcenter STAR-CCM+ is a multiphysics CFD software that enables CFD engineers to model the complexity and explore the possibilities of products operating under real-world conditions.",https://plm.sw.siemens.com/en-US/simcenter/fluids-thermal-simulation/star-ccm/,,"Commercial License","fluid dynamics, mechanical engineering","fluid-dynamics, mechanical-engineering, simulation"
Stata,"Stata is a statistical software package widely used by researchers in various disciplines for data analysis, data management, and visualization. It provides a comprehensive suite of statistical tools for both beginners and advanced users.",https://www.stata.com,,"Commercial License","statistics and probability, economics and business, social sciences","statistics, data-analysis, economics"
TensorBoard,"TensorBoard is a visualization toolkit provided with TensorFlow for monitoring and visualizing various aspects of machine learning models and data. It offers interactive dashboards for tracking training metrics, visualizing computational graphs, and analyzing model performance and behavior.",https://www.tensorflow.org/tensorboard,,"Open-Source License","machine learning, artificial intelligence","machine-learning, deep-learning, visualization"
VARNA,"VARNA is Java lightweight Applet dedicated to drawing the secondary structure of RNA. It is also a Swing component that can be very easily included in an existing Java code working with RNA secondary structure to provide a fast and interactive visualization.",https://varna.lisn.upsaclay.fr/,,"Open-Source License","bioinformatics, structural biology","structural-biology, visualization"
VisIt,"VisIt is an open-source, interactive parallel visualization and graphical analysis tool used for visualizing scientific data. It is particularly focused on large-scale simulations and post-processing of complex data sets, enabling researchers to analyze and present their data in a visually engaging manner.",https://visit-dav.github.io/visit-website/,,"Open-Source License","physics, computational science, visualization","visit, visualization, data-analysis"
"Visual Studio Code","Visual Studio Code is a powerful source code editor developed by Microsoft for Windows, macOS, and Linux. It includes support for debugging, embedded Git control, syntax highlighting, intelligent code completion, snippets, and code refactoring.",https://code.visualstudio.com,,"Open-Source License","computer science, software engineering","programming, debugging, gui"
VMD,"VMD is a molecular visualization program for displaying, animating, and analyzing large biomolecular systems using 3-D graphics and built-in scripting. VMD supports computers running MacOS X, Unix, or Windows, is distributed free of charge, and includes source code.",https://www.ks.uiuc.edu/Research/vmd/,,"Open-Source License","structural biology, biophysics, computational science","molecular-dynamics, visualization, structural-biology"
WebMO,"WebMO is a web-based interface designed to facilitate access to computational chemistry packages. It allows students and non-specialists to run advanced computational chemistry programs directly from their web browser. The interface is intuitive for novices, featuring a point-and-click molecular editor, predefined job types, and reasonable default values. At the same time, it is flexible enough for experts, offering advanced job options and full access to input and output files.",https://www.webmo.net,,"Open-Source License","chemistry, computational chemistry","computational-chemistry, chemistry, gui"
"Workflow Composers","Tool or framework that lets users design, organize, and automate complex scientific or engineering workflows—chaining together simulations, data processing, and analysis tasks—so they can run efficiently on supercomputers or HPC clusters.",https://osc.github.io/ood-documentation/release-1.8/customization.html?highlight=workflow%20composer,,,"bioinformatics, computational science","workflow, data-management, automation"
XCrySDen,"XCrySDen is a crystalline and molecular structure visualisation program aiming at display of isosurfaces and contours, which can be superimposed on crystalline structures and interactively rotated and manipulated. It runs on GNU/Linux.",http://www.xcrysden.org/,,"Open-Source License","condensed matter physics, materials science","condensed-matter, visualization, materials-science"
XDMoD,"XDMoD, which stands for XD Metrics on Demand, is an NSF-funded open source tool that provides a wide range of metrics pertaining to resource utilization and performance of high-performance computing (HPC) resources, and the impact these resources have in terms of scholarship and research.",http://open.xdmod.org/,,"Open-Source License","high-performance computing, performance evaluation and benchmarking","xdmod, reporting, performance-tuning, benchmarking"
XFPLO,"The FPLO® package is a full-potential local-orbital code [1] [2] to solve the Kohn-Sham equations [5] on a regular lattice or with free boundary conditions (finite systems). Relativistic effects are treated either in a scalar-relativistic or a full 4-component formalism [3]. Available functionals are LSDA, GGA (PBE 96) and LSDA/GGA+U. [4]. Orbital polarization correction can be applied.",https://www.fplo.de/,,"Open-Source License","condensed matter physics, materials science","condensed-matter, materials-science, simulation"
